review_id,product_id,reviewer_id,stars,review_body,review_title,language,product_category
es_0925542,product_es_0480881,reviewer_es_0435205,4,"Son bonitos y tamaño adecuado,no se si durará mucho el baño que llevan,pero están muy bien para el precio que tienen. Pero tienen una pega, en mi opinión inaceptable,son los dos de la misma mano.",Cipriano Caballero,es,jewelry
es_0966111,product_es_0585433,reviewer_es_0111037,1,"Una pérdida de dinero total, la compre a finales de marzo y de la noche a la mañana ha dejado de funcionar. Ya no estoy en plazo de reclamar, pero si me pongo por lo legal estoy dentro del año de garantía, espero que me den una solución.",Ya no funciona,es,video_games
es_0676699,product_es_0506584,reviewer_es_0661793,2,"A mi hijo no le ha echo mucha gracia el juego, de hecho lo tiene olvidado en el cajón, no le ha enganchado demasiado. Es complejo de jugar y algo aburrido.",Regular,es,video_games
es_0225317,product_es_0945080,reviewer_es_0988665,4,"Las baterías encajan a la perfección en el mando original de la xbox. El cable no entra a la perfección, pero una vez dentro, se ve robusto, y que no se va a soltar aunque estés moviendo el mando seguido. Eso sí, lo que es el cable, es un poco más fino que el del original, pero tampoco se ve frágil. Aún no probé la duración de las baterías, ni el tiempo de carga. Pero de primeras muy bien",producto muy válido,es,video_games
es_0428316,product_es_0151976,reviewer_es_0706859,1,"Lo pedí para navidad y nunca llegó, ni actualizaron el estado del producto, ni me llamaron para informarme de nada. Un día llamé y me informaron que el repartidor había perdido el paquete, al ser muy pequeño. Una auténtica verguenza","Nunca me llegó el artículo, el repartidor lo perdió",es,jewelry
es_0783117,product_es_0871877,reviewer_es_0321281,3,"Le pongo 3 estrellas porque es un gran juego a buen precio, pero la desarrolladora ha sido una vaga, prácticamente la misma versión, a 30 FPS, sigue estando en inglés...","Juegazo, pero la desarrolladora ha sido muy vaga",es,video_games
es_0697878,product_es_0867697,reviewer_es_0461961,5,Mando pequeño y que funciona perfectamente tanto con PC (aunque requiere poseer un receptor ya que es solo mando) y para con telefono Android.,Mando pequeño perfecto.,es,video_games
es_0092581,product_es_0252313,reviewer_es_0881543,3,"Si el mando lleva una funda, olvídate que no llegará a conectar correctamente.",Poco satisfecho,es,video_games
es_0762294,product_es_0708499,reviewer_es_0603395,1,"La calidad del mando pésimo. En menos de un mes el botón LB se quedó trabado y no puedo usar el mando. Encima la garantía solo dura un mes ,justo para no hacer la devolución .",Pésimo,es,video_games
es_0620605,product_es_0555027,reviewer_es_0831964,1,Mucho tiempo en llegar y el artículo fatal,Decepcionada,es,jewelry
es_0698834,product_es_0694921,reviewer_es_0712452,3,"La verdad es que encajan bastante bien los mandos, me ha gustado. La calidad no es mala aunque en lineas generales es un articulo muy normalito.",Esta bien.,es,video_games
es_0212942,product_es_0077303,reviewer_es_0579087,3,"Este producto no esta mal. Si se te ha roto el cargador original, puedes sustituirlo por este. Funciona tanto directamente al puerto tipo C de la switch como a traves del dock original pudiendo en este caso ver la switch en la tv y cargarlo a la vez. ""Pero"" le he visto un par de inconvenientes; por un lado la clavija esta muy dura al pincharla y da un poco de miedo por si rompes la hembra de entrada y por otro lado lo he probado en dispositivos alternativos al dock original de nintendo y en este caso no funciona. Por tanto si no tienes el dock original de nintendo este producto no te vale.","Sustituye al original ""pero""",es,video_games
es_0970090,product_es_0313190,reviewer_es_0214363,4,"Quizá un poco caro por 25€ pero es que el juego es brutal. Uno de los mejores. Esta edición tiene todo el contenido disponible y funciona perfectamente en Xbox One y se instala en Español. La carátula es exactamente la que viene en la foto, la que pone Xbox One y Xbox 360. Pero OJO, es versión NTSC, si lo compras para tu Xbox 360 PAL no te funcionará","Perfecto para Xbox One, se instala en Español. Pero es NTSC cuidado con comprarlo para 360",es,video_games
es_0327552,product_es_0040952,reviewer_es_0852588,3,Es como en la foto pero es cuestión de gustos.,Bueno.,es,jewelry
es_0774971,product_es_0299301,reviewer_es_0569765,2,"El cierre no es muy seguro. Se me perdió. Por lo demás, todo bien, aunque la fiabilidad de los cierres en las pulseras es algo básico.",Cierre no seguro,es,jewelry
es_0908752,product_es_0030571,reviewer_es_0248400,4,"Me llegó rápido, sin abrir, el código se aplicó sin problemas. Pongo cuatro estrellas porque no especificaba qué tipo de caja era, si la desplegable con el texto dentro o la clásica que viene sólo con el disco, resultó ser la segunda, un poco más cutre, pero por lo demás, perfectamente.","Bien, sin problemas.",es,video_games
es_0023751,product_es_0849526,reviewer_es_0762246,3,El diseño y lo sencillo,Bien,es,jewelry
es_0624262,product_es_0002416,reviewer_es_0685762,3,"Me han llegado bien, pero he tenido que limpiarlos porque la plata venía oscurecida. Han quedado bien y no he tenido que devolverlos afortunadamente.... No me daba tiempo ya que eran para regalo",Bonitos pero no han venido bien del todo,es,jewelry
es_0110301,product_es_0243400,reviewer_es_0199417,4,"No hace apenas ruido, y por el precio que tiene funciona bastante bien. Los cargadores de los mandos también van perfectos.",Buen producto,es,video_games
es_0736695,product_es_0984488,reviewer_es_0041748,3,"La pulsera es de calidad según la ves y sobre todo la tocas, pero no es de la medida que pone Ya aviso que son 2 centímetros más pequeña.",Pulsera Tempur,es,jewelry
es_0357904,product_es_0363069,reviewer_es_0263261,4,"Acerté con el regalo, lo recomiendo queda muy chulo. El tamaño del colgante está bien justo como sale en la foto. Viene con una cadena que está bien para el precio.",Genial para regalar.,es,jewelry
es_0504138,product_es_0380363,reviewer_es_0755871,2,"No es como la foto, sólo se ven los cristales por un lado",Pulsera,es,jewelry
es_0070377,product_es_0057553,reviewer_es_0080235,3,"Funciona genial por ahora y lo que mas me ha gustado es que mi compañera ya no me quita el mio(el azul) Lo que menos me ha gustado es que la caja que lo trae es mas morada que el mando,que ademas es transparente.","A mi compañera y a mi,nos ha encantado",es,video_games
es_0762362,product_es_0888136,reviewer_es_0144933,3,Es un juego bastante sencillo. Mi hijo lo pidió porque le llamó la atención pero al jugar no le convenció. Y ya se cansó.,Horacio,es,video_games
es_0406102,product_es_0966051,reviewer_es_0968001,5,Ideal para lo que quiera tunear,Precioso,es,jewelry
es_0685936,product_es_0270321,reviewer_es_0242849,5,Lo compré para regalo del día de la madre y ha sido todo un acierto. Es muy bonita y trae un charla de presión para que si se abre no se caigan los demás. Mi suegra está encantada con su pulsera United Regal Corazón.,Muy elegante.,es,jewelry
es_0117330,product_es_0671274,reviewer_es_0566147,5,"Muy contento con la compra, dispone de regulador de sonido y funciona perfecto y es muy util. Son muy comodos, y cuando llevas un rato con ellos puestos no notas absolutamente nada. Las almohadillas son muy comodas, el microfono se escucha muy bien y el sonido del propio auricular es muy bueno! Lo recomiendo 100%",Comodos y de Calidad.,es,video_games
es_0957793,product_es_0349785,reviewer_es_0726744,5,Versión con todos los extras y totalmente en castellano en cuanto lo pones en la Play,Una pasada de juego,es,video_games
es_0190450,product_es_0919612,reviewer_es_0069850,3,"me gustaría saber si se pueden sacar eslabones pues son como remaches, sin endiduras para poder sacar eslabones",Se puede acortar la pieza?,es,jewelry
es_0114406,product_es_0889345,reviewer_es_0510860,2,"El peor juego que he visto, no tienes nada que hacer, lo pasas en 5 minutos, no es atractivo, pésimo",Peor,es,video_games
es_0521753,product_es_0860107,reviewer_es_0004661,3,"buscaba dos anillos que fuesen a juego y extensibles, para poder llevarlos mi mujer y yo, y me decidí por estos. Llegan super bien presentados en una cajita etc, como presentacion fantásticos. Los anillos son bonitos, no muy grandes, y por la parte de abajo tienen un ""corte"" y por eso se pueden ajustar a dedos más grandes, nosotros por ejemplo, lo llevamos en el dedo pulgar. Le pongo solo 3 estrellas, porque en menos de 1 semana el anillo de mi mujer ha perdido una piedra, una lástima, porque todo estaba perfecto, si no hubiese caído esta piedra lo hubiera puntuado mejor, pero siendo así, no puedo darle más de eso. Pero bueno, por el precio que es, no los veo nada mal. Espero que las fotos os sirvan de ayuda. Salu2!",bien para su precio peero....,es,jewelry
es_0823164,product_es_0552710,reviewer_es_0907403,3,Bonito y adecuado para lo que es,Buen precio,es,jewelry
es_0318451,product_es_0103422,reviewer_es_0473578,5,"Quería regalar a mi mujer unos pendientes de plata y me decanté por estos porque le gustan las estrellas. Le han encantado y fue un acierto su elección. Los pendientes no son muy grandes, cada estrella tiene 6 brillantitos que brillan con el reflejo de La Luz, y puestos quedan muy elegantes. Respecto al cierre, incorporan 2 diferentes: unos de plata y otros de plástico. Vienen metidos en 2 bolsitas de plásticos (pendientes por un lado y cierres por otro) y, a su vez, dentro de una cajita de las de joyería por lo que le da un toque de calidad. Otro aspecto positivo, es que por su forma y tamaño, no sólo son válidos para mujeres, sino que también valdrían para niñas y adolescentes.",Pendientes muy elegantes,es,jewelry
es_0483894,product_es_0801464,reviewer_es_0841082,1,"Regular la verdad, pense que seria mas bonito, no es tan parecido a la.foto que aparece, el mapa no esta muy bien la verdad",Producto regular,es,jewelry
es_0743873,product_es_0196950,reviewer_es_0780705,4,"Los reyes se han portado, superdivertido, el envio y el producto llego bien",Juegos nintendo swich,es,video_games
es_0731621,product_es_0296449,reviewer_es_0088766,4,La verdad es que no he jugado y no puedo decir nada,Mi hijo muy contento,es,video_games
es_0716494,product_es_0857881,reviewer_es_0135253,4,Sigue la línea de los anteriores,Bueno,es,video_games
es_0316031,product_es_0840361,reviewer_es_0964989,5,Insuperable en calidad/precio,Calidad/precio,es,jewelry
es_0499760,product_es_0824455,reviewer_es_0532950,4,Corresponde con lo esperado,Correcto,es,jewelry
es_0561761,product_es_0254629,reviewer_es_0269451,3,Me encantó hasta que vi que el mando Pro de la Nintendo Switch no encajaba.,No vale para todos los mandos,es,video_games
es_0420700,product_es_0649461,reviewer_es_0358315,4,"El collar es bonito, del tamaño que indica en las fotos. La cadena tambien es muy finita con lo cual acompaña al collar. El collar parece de calidad. Yo se lo compré a mi novia porque la gustan mucho los gatos y entre este y otro que habia me gusto este. Le queda como anillo al dedo, al ser pequeñito, la gusta más porque lo quiere usar diariamente. Esta muy contenta con el regalo.",Discreto pero bonito,es,jewelry
es_0080439,product_es_0295046,reviewer_es_0366743,3,"es linda ,cómoda pues solo es atada y queda muy bonita puesta gracias",Hay que tener un poco de paciencia v,es,jewelry
es_0494663,product_es_0433765,reviewer_es_0528759,2,"En la foto parece otra cosa. Yo entiendo que el precio no es muy alto y la calidad no puede ser espectacular, pero tanto...",Elena,es,jewelry
es_0409581,product_es_0559183,reviewer_es_0910089,2,"Esta conjunto de pendientes y collar sorprende por su bajo precio. Aun no tengo datos para valorar su calidad, porque lo he recibido anteayer pero en principio tiene buen aspecto. Lo que ya no me parece tan bueno es el embalaje utilizado. Un artículo tan delicado como este no puede ir en un simples sobre de burbujas con tan poco recubrimiento. El resultado es, como se puede apreciar en la fotos, los vástagos de los pendientes vienen todos doblados (compré tres unidades). Sería interesante que utilizaran una caja para ello. Ahora toca el proceso de enderezado que, espero que soporten. De todas maneras por lo que cuestan tampoco se les puede pedir más.",Producto con buena relación calidad-precio pero mal embalado,es,jewelry
es_0471584,product_es_0035044,reviewer_es_0868126,4,Era para un regalo y gusto mucho porque era un seguidor de esta saga de videojuegos,Regalo,es,video_games
es_0220009,product_es_0562176,reviewer_es_0134649,2,Me ha encantado . Adaptable y de momento no me ha dejado el dedo verde jijiji.,Adaptable,es,jewelry
es_0052011,product_es_0394190,reviewer_es_0122419,4,Es muy bonita. Precio y calidad magnífico. Es un regalo que ha gustado mucho.,Elegante,es,jewelry
es_0297135,product_es_0956155,reviewer_es_0001296,2,Excesivamente pequeño (no cabe ni una moneda de 5 CTS) y mala calidad en el cierre,Minúsculo,es,jewelry
es_0743112,product_es_0807074,reviewer_es_0978889,5,"Adorables! Son muy bonitos, de tamaño bueno y un brillo discreto. Las perlas le dan el toque extra. Preciosos!!!",Compra perfecta!,es,jewelry
es_0152166,product_es_0559183,reviewer_es_0847519,3,"Es gracioso... Para una niña. No es bueno y los acabados no son perfectos, pero tampoco se puede pedir mucho más por ese precio.",Bien,es,jewelry
es_0895535,product_es_0722158,reviewer_es_0823548,1,"No son compatibles con la Nintendo NES original como ahí dice. Estéticamente son iguales incluido el conector, pero no funcionan. Yo los tuve que devolver.",No compatibles con Nes original,es,video_games
es_0098575,product_es_0137177,reviewer_es_0143980,5,Muy bueno y divertido. Para mayores de 18 años. Entrega y todo perfecto. Era de segunda mano y estaba en perfecto estado cuando llegó.,Muy bueno,es,video_games
es_0707366,product_es_0911860,reviewer_es_0063177,1,Deberían comprobar el producto antes de venderlo. A la decepción de no haberlo podido usar se añade el inconveniente de tener que devolverlo.,El codigo del DLC ya habia sido utilizado,es,video_games
es_0638226,product_es_0352892,reviewer_es_0094438,2,"Bonito, pero no me lo han mandado con la bolsa de la marca, lo que para un regalo desmerece mucho. La próxima lo compro en la tienda de Tous, pues están al mismo precio.",Bonito,es,jewelry
es_0948421,product_es_0166405,reviewer_es_0474544,4,Muy útil y manejable,Pequeña,es,video_games
es_0398696,product_es_0561581,reviewer_es_0044635,4,"Es un colgante muy bonito, pero es muy muy pequeño, demasiado . El plazo de entrega ha sido muy rápido.",Bonito pero muy pequeño,es,jewelry
es_0433757,product_es_0169025,reviewer_es_0915557,4,"Algo pequeño, pero bonito",Algo pequeño,es,jewelry
es_0837302,product_es_0325907,reviewer_es_0906470,1,"No megusto nada el primer día se rompió el brillo y el segundo día se perdió la tuerca,y el tercero me puso la oreja como un elefante,en fin porquería.",Dumbo,es,jewelry
es_0064829,product_es_0873046,reviewer_es_0505009,3,Incomodo al abrir y cerrar se atasca con la lengüeta donde van los juegos,Mejorable,es,video_games
es_0233248,product_es_0719056,reviewer_es_0311978,4,"Buen regalo, preciosa. Brilla bastante y parece que es de calidad.Espero que no cambie de color ni pierda piedras.Lo recomiendo",Bonita,es,jewelry
es_0504462,product_es_0164099,reviewer_es_0372739,4,"Se han comprado dos iguales, para uso propio y para un regalo, son finitas, pero resultan elegantes. Mejor de lo esperado!!",Fina pero perfecta!!,es,jewelry
es_0388977,product_es_0852775,reviewer_es_0205264,5,Lo compré como regalo del día del padre y a mi marido le encantó.,Como Las antiguas,es,video_games
es_0102219,product_es_0324664,reviewer_es_0473539,3,Calidad media. Con el tiempo y con el agua se borra lo que tiene escrito. Por el precio que tiene es lo que obtienes,No es buena calidad,es,jewelry
es_0337452,product_es_0331697,reviewer_es_0815113,1,"Llegó a tiempo y en perfecto estado al poco tiempo dejo de funcionar. Parecía que todo iba bien, pero no.",Un chasco,es,video_games
es_0289980,product_es_0994178,reviewer_es_0907534,3,Figura con buen detalle pero poca calidad,Material malo de la figura,es,video_games
es_0250816,product_es_0514708,reviewer_es_0603446,2,"Debido a problemas con la compañía de transporte AMS el pedido llegó un día después de lo indicado, además el juego venía sin precintar, simplemente con un trozo de celo para evitar que la caja se abriese. Está en perfecto estado pero me hace dudar bastante de su procedencia.",Poco profesional..,es,video_games
es_0715567,product_es_0256804,reviewer_es_0016124,3,"Buena calidad, pero le sobran los botones interiores, hacen que los pulses sin querer y eso Estropea partidas.",Para que hacen cosas raras?,es,video_games
es_0867582,product_es_0475262,reviewer_es_0002421,2,Tendría que especificar el diámetro de la circunferencia para meter la pulsera ya que no es para todas las Pandora.,Pequeña,es,jewelry
es_0295309,product_es_0824455,reviewer_es_0924081,2,"A mí no me ha gustado, creo que son demasiado endebles. Son baratos, si, pero de baja calidad.",Poco útiles,es,jewelry
es_0583717,product_es_0327172,reviewer_es_0593255,5,"Encaja perfectamente en la pulsera Pandora. Es más bonito en persona que en la foto, queda muy elegante. Estoy encantada con la compra!",Muy bonito!,es,jewelry
es_0388396,product_es_0800587,reviewer_es_0399632,1,Lo compré porque decía que era de plata. Pero no lo es,Pulsera bisutería,es,jewelry
es_0206601,product_es_0838133,reviewer_es_0133524,4,"En general buen producto, un poco demorado el envio, lo importante es que encajan bien en la nintendo DSi.",Buen producto,es,video_games
es_0318094,product_es_0677319,reviewer_es_0700769,2,Mas pequeños de lo que esperaba.,Aceptables,es,jewelry
es_0287816,product_es_0269465,reviewer_es_0975388,4,"Son muy bonitos y realmente brillan mucho, lo único es que me dan un poco de alergia!!",Calidad precio excepcional,es,jewelry
es_0588487,product_es_0141880,reviewer_es_0291620,1,"El cartucho venía con una pestaña doblada, lo cuál hacia que no funcionase.",Problema de fábrica,es,video_games
es_0947522,product_es_0944663,reviewer_es_0647508,4,"El juego en sí es increíble. A estas alturas de la generación poco más se puede decir salvo que es el simulador de conducción por excelencia, el mejor en su género en consolas. El pero viene por el envío de Amazon. El juego me lo envían sin precinto original, abierto, probablemente procedente de alguna devolución, cosa que no especifican en ningún momento. Además y para colmo, la caja vino con una de las pestañas rotas. Impresionante el mal gusto por parte de Amazon al enviar el producto de esta manera: Gracias a dios el disco está impoluto y el precio aún así mereció la pena, pero me tocará comprar algún juego de segunda mano barato para cambiar la caja.","Juego impresionante, pésimo envío por Amazon",es,video_games
es_0326543,product_es_0948485,reviewer_es_0781322,2,"Como principal, decir, que aunque venga la contraportada en Español, el juego esta en Frances,Ingles y Aleman. Que te lo vendan asi, me parece que es engañar a la gente. Sobre el juego, esperaba mas y veo que va a estar cargado de DLC de pago, en lo demas, hay alternativas indies mejores que lo que es Harvest Moon actualmente.",Regulero,es,video_games
es_0930270,product_es_0055012,reviewer_es_0729668,2,"Llegó bien, pero el aspecto y peso son demasiado simples, recuerda al plástico, y las piedras de circonita me decepcionaron. Desde luego, el fotógrafo de la foto con la que lo venden es un fenómeno. Claramente peores en la realidad. El empaquetado es muy simple. Mi mujer me ha pedido devolverlos y que no le vuelva a regalar bisutería. Lección aprendida.",No me gustó.,es,jewelry
es_0657011,product_es_0723812,reviewer_es_0867091,5,Los pendientes son como esperaba. Compré antes la sortija y ahora los pendientes. Llegaron en la fecha prevista y en buen estado. Muy contenta con la compra.,De buena calidad y muy bonitos.,es,jewelry
es_0254957,product_es_0594923,reviewer_es_0935564,4,"Gran reproducción de los originales. Da alguna sensación de fragilidad, pero ideal para jugar con un emulador de saturn",Buen mando para emulador de saturn,es,video_games
es_0393246,product_es_0759925,reviewer_es_0359756,5,"La pulsera es de muy buena calidad, la verdad es que era algo reacio a adquirir este tipo de regalos a través de Amazon, pero está pulsera me ha demostrado lo equivocado que estaba... Al ser de acero inoxidable está brillante como el primer día, a mi novia aun no se le ha puesto negra ni nada extraño y eso que no se la quita para nada, la lleva puesta 24/7. De hecho recientemente, fuimos a una boda nocturna y la utilizo de accesorio para combinar su vestido, y se llevó más de una mirada. Volviendo al aspecto más técnico, el cierre también es muy bueno y cómodo de utilizar, pudiéndose ajustar para las muñecas de cualquier tamaño. Por todo lo anterior, afirmo que es excelente para regalar, diría que es un producto recomendado con una muy buena calidad-precio.",Pulsera brillante y de gran calidad,es,jewelry
es_0129404,product_es_0136846,reviewer_es_0071453,4,"Muy bonito, Estaba preocupado por si eran muy grandes pero no , le ha gustado, El tamaño muy bien. Lo que no estoy muy seguro es que sea plata , o bañado dn plata","Pequeños/medianos, bonitos y elegantes",es,jewelry
es_0978122,product_es_0128736,reviewer_es_0313236,5,"La pulsera es muy bonita,tal y como sale en la imagen.Envio rápido y con detallito,que se agradece.Volveré a comprar.",Satisfecha con la compra,es,jewelry
es_0766909,product_es_0873282,reviewer_es_0213918,1,Hola quería comentar que tuve que cambiarlo porque el botón L2 se accionaba solo. Y el que me mandaron nuevo a día de hoy le pasa otra vez lo mismo. Muchas gracias,Mando PS4 malisimo,es,video_games
es_0322835,product_es_0459655,reviewer_es_0146117,5,Calidad precio buena,Bueno,es,jewelry
es_0373637,product_es_0508408,reviewer_es_0195840,5,la primera vez que compro en amazon y no será la ultima porque ha sido perfecta.,rapidez y confianza,es,video_games
es_0541180,product_es_0962651,reviewer_es_0857740,5,La verdad un producto muy bueno. Me ducho con ella y no se pone negra. Es muy bonita .,Lo compraría otra vez,es,jewelry
es_0471680,product_es_0983734,reviewer_es_0922085,2,"Aunque se puede configurar el idioma, me parece inaceptable que todo en la caja venga en italiano y ni siquiera te lo indiquen en la descripción. Por favor, den toda la información de su producto de forma concisa.","Ojo!!, versión italiana del juego.",es,video_games
es_0823963,product_es_0954873,reviewer_es_0314633,3,"La experiencia en el montaje es de 10, cómo VR, no deja de ser un experimento/juguete simpático sin más... nada que ver con la VR real de visores normales.",Calidad/Precio Insuperables.,es,video_games
es_0462398,product_es_0039250,reviewer_es_0480484,5,"He comprado este artículo en 2 ocasiones, para 2 regalos diferentes para niñas de 4-5 años y han tenido muy buena acogida. La fabricación en general del conjunto es bastante buena. Plata de ley y los brillantes muy resultantes. Las niñas que lo recibieron quedaron encantadas con el regalo, las dos.",ideales para regalo,es,jewelry
es_0584101,product_es_0273029,reviewer_es_0927639,1,Llega así tal se ve en la foto. Solo una pieza y parece usado. Nunca más.,Fatal.,es,video_games
es_0078100,product_es_0278028,reviewer_es_0908278,1,"Malísimos, un día me duraron.Llegaron descoloridos pero es que tal y como me los puse,uno roto",Mala calidad,es,jewelry
es_0218881,product_es_0763090,reviewer_es_0707176,1,La caja llego abierta y faltaban los códigos de los juegos. Después de llamar por tlf. y varios correos fueron incapaces de resolverlo. Al final tuve que gestionarlo por mi cuenta con Microsoft. Amazon un cero y los agentes que me atendieron otro cero.,Amazon inútiles,es,video_games
es_0674746,product_es_0428105,reviewer_es_0186498,2,El tamaño de la mano es perfecto!pero es corta la cadena y se me rompió al mes el broche,",,,,",es,jewelry
es_0796327,product_es_0741008,reviewer_es_0123114,1,Este es un aviso para la gente que compran de Amazon después de tantos años comprando de Amazon he tenido que devolver piezas de ordenador porque fallaba siempre después de devolver todas las piezas ahora ni me contestan ni me devuelvan el dinero es una estafa devolver productos a Amazon os lo juro llevo ya dos semanas y no mcen nada llamo y mando emails y nada son más de 2300 euros me lo han robado y los voy a denunciar os aviso para que lo sepáis si os toca devolver algo a Amazon mejor hacéis un vídeo hasta el momento de dejar el paquete a la oficina de depende vais a dejar el paquete buena suerte,Estafa de Amazon,es,video_games
es_0037124,product_es_0191062,reviewer_es_0710222,5,"Juegazo, es una pasada",Hordas y hordas de zombis,es,video_games
es_0750477,product_es_0872154,reviewer_es_0971619,5,Tal y como se ven en las fotos.Muy buena calidad y precio,Excelente,es,jewelry
es_0346191,product_es_0528395,reviewer_es_0021161,1,"La consola se apaga de forma continua por sobrecalentamiento, cuando la tengo en el mismo espacio que la PS4 Pro. Es un fallo de diseño grave que por supuesto Microsoft no asume. Lamentable.",Mal producto y peor atención al cliente,es,video_games
es_0158703,product_es_0963761,reviewer_es_0971769,1,Servicio penoso. No lo esperaba. Desde el 13 de junio que hice el pedido. Han debido fe ir a buscarlo a la India,Ana belen sanchez garcia,es,jewelry
es_0338417,product_es_0973141,reviewer_es_0950996,4,"Es muy chulo y práctico, llego muy rápido y de momento funciona muy bien",Bonito!,es,video_games
